{
  "assessment_id": "assessment-example-SCN-001",
  "assessment_level": "behavioral",
  "assessment_subject": {
    "id": "run-example-001",
    "type": "run"
  },
  "assessor": {
    "name": "eas-reference-assessor",
    "version": "0.1.0.dev0"
  },
  "completed_at": "2026-07-25T16:34:11Z",
  "eas_version": "0.1",
  "limitations": [
    "Artifact integrity checks establish presence and digest only; they do not establish semantic authenticity.",
    "Passing the declared scenario set does not establish universal behavioral conformance beyond that set and EAS version."
  ],
  "record_created_at": "2026-07-25T16:34:11Z",
  "registries": {
    "requirements": "0.1.1",
    "validator_rules": "0.1.1"
  },
  "requirement_results": [
    {
      "applicability": {
        "action_or_state": "not_invoked",
        "applicable": true,
        "base": "invoked",
        "basis": "Scenario SCN-001 declares the requirement in scope and the registry applicability tags were evaluated across all dimensions.",
        "risk_or_event": "not_invoked",
        "selected_profile": "not_invoked",
        "subject_match": "matched",
        "task_class": "not_invoked"
      },
      "assessment_subject": "run",
      "evidence_refs": [],
      "level": "MUST",
      "reason": "The executed deterministic checks for this requirement passed.",
      "requirement_id": "EAS-002-R07",
      "result": "pass",
      "scenario_refs": [
        "SCN-001"
      ],
      "title": "Recognized task classification",
      "validator_rule_refs": [
        "VAL-TASK-CLASS",
        "VAL-TASK-CLASSIFICATION-DETAILS"
      ]
    },
    {
      "applicability": {
        "action_or_state": "not_invoked",
        "applicable": true,
        "base": "invoked",
        "basis": "Scenario SCN-001 declares the requirement in scope and the registry applicability tags were evaluated across all dimensions.",
        "risk_or_event": "not_invoked",
        "selected_profile": "not_invoked",
        "subject_match": "matched",
        "task_class": "not_invoked"
      },
      "assessment_subject": "run",
      "evidence_refs": [],
      "level": "MUST",
      "reason": "The executed deterministic checks for this requirement passed.",
      "requirement_id": "EAS-002-R10",
      "result": "pass",
      "scenario_refs": [
        "SCN-001"
      ],
      "title": "Satisfied task result requires completed outcome",
      "validator_rule_refs": [
        "VAL-TASK-RESULT-OUTCOME"
      ]
    },
    {
      "applicability": {
        "action_or_state": "invoked",
        "applicable": true,
        "base": "not_invoked",
        "basis": "Scenario SCN-001 declares the requirement in scope and the registry applicability tags were evaluated across all dimensions.",
        "risk_or_event": "not_invoked",
        "selected_profile": "not_invoked",
        "subject_match": "matched",
        "task_class": "not_invoked"
      },
      "assessment_subject": "run",
      "evidence_refs": [],
      "level": "MUST",
      "reason": "The executed deterministic checks for this requirement passed.",
      "requirement_id": "EAS-005-R14",
      "result": "pass",
      "scenario_refs": [
        "SCN-001"
      ],
      "title": "Deterministic materiality classification",
      "validator_rule_refs": [
        "VAL-MATERIALITY-CLASSIFICATION"
      ]
    },
    {
      "applicability": {
        "action_or_state": "not_invoked",
        "applicable": true,
        "base": "invoked",
        "basis": "Scenario SCN-001 declares the requirement in scope and the registry applicability tags were evaluated across all dimensions.",
        "risk_or_event": "not_invoked",
        "selected_profile": "not_invoked",
        "subject_match": "matched",
        "task_class": "not_invoked"
      },
      "assessment_subject": "run",
      "evidence_refs": [],
      "level": "MUST",
      "reason": "The executed deterministic checks for this requirement passed.",
      "requirement_id": "EAS-007-R05",
      "result": "pass",
      "scenario_refs": [
        "SCN-001"
      ],
      "title": "Complete final run report",
      "validator_rule_refs": [
        "VAL-RUN-REQUIRED-FIELDS",
        "VAL-VERIFICATION-SHAPE"
      ]
    },
    {
      "applicability": {
        "action_or_state": "not_invoked",
        "applicable": true,
        "base": "not_invoked",
        "basis": "Scenario SCN-001 declares the requirement in scope and the registry applicability tags were evaluated across all dimensions.",
        "risk_or_event": "invoked",
        "selected_profile": "not_invoked",
        "subject_match": "matched",
        "task_class": "not_invoked"
      },
      "assessment_subject": "run",
      "evidence_refs": [],
      "level": "MUST",
      "reason": "The executed deterministic checks for this requirement passed.",
      "requirement_id": "EAS-009-R09",
      "result": "pass",
      "scenario_refs": [
        "SCN-001"
      ],
      "title": "Structural-first complete scenario assessment",
      "validator_rule_refs": [
        "VAL-SCENARIO-STRUCTURAL-FIRST",
        "VAL-SCENARIO-EXPECTATIONS",
        "VAL-ARTIFACT-BUNDLE"
      ]
    }
  ],
  "scenario_set": {
    "id": "ad-hoc",
    "scenario_ids": [
      "SCN-001"
    ],
    "version": "0.1.0"
  },
  "schema_version": "0.1.0",
  "source_record": {
    "artifact_ref": "examples/minimal-run.json",
    "id": "run-example-001",
    "record_created_at": "2026-07-11T00:02:00Z",
    "schema_version": "0.1.0",
    "sha256": "9131a253941a0a58367bf64f2ce76d3279636c39f5f81a1b161d0db253cc363d",
    "type": "run"
  },
  "started_at": "2026-07-25T16:34:11Z",
  "summary": {
    "counts": {
      "fail": 0,
      "indeterminate": 0,
      "not_applicable": 0,
      "pass": 5,
      "total": 5
    },
    "result": "pass"
  }
}
